{
  "$id": "urn:ratatoskr:contracts:sites:v1:Release",
  "$schema": "https://json-schema.org/draft/2020-12/schema",
  "title": "Release",
  "description": "Contract `sites/release.v1`: one immutable release of a site, as the delivery route\n`/v1/sites/{site}/content/release` serves it.\n\nThe release id is the lowercase hex SHA-256 of the RFC 8785 form of this document (workspace\ndesign D4), so the document does not hold its own id. Every list is sorted and holds each item\nonce, so one content gives one id. The document names pages by slug and assets by SHA-256, never\nby vault path, and every other member is refused.\n\n`Deserialize` is hand-written because the order rules span a list and a navigation entry must\nname a page of the release. It parses a private mirror struct and then calls\n[`Release::validate`].",
  "type": "object",
  "properties": {
    "assets": {
      "description": "Every asset that a page of the release uses, in ascending order of SHA-256, each once.",
      "type": "array",
      "items": {
        "$ref": "#/$defs/ReleaseAsset"
      }
    },
    "navigation": {
      "description": "The navigation tree of the site, in the order the site shows it.",
      "type": "array",
      "items": {
        "$ref": "#/$defs/NavigationEntry"
      }
    },
    "pages": {
      "description": "Every page of the release, in ascending order of slug, each slug once.",
      "type": "array",
      "items": {
        "$ref": "#/$defs/ReleasePage"
      }
    },
    "publication_ids": {
      "description": "The publications whose pages the release holds, in ascending order, each once.",
      "type": "array",
      "items": {
        "$ref": "#/$defs/PublicationId"
      },
      "uniqueItems": true
    },
    "site_id": {
      "description": "The site that the release belongs to.",
      "$ref": "#/$defs/SiteId"
    }
  },
  "additionalProperties": false,
  "required": [
    "assets",
    "navigation",
    "pages",
    "publication_ids",
    "site_id"
  ],
  "x-ratatoskr-provenance": {
    "canonical_source": "ratatoskr_sites_contracts::Release",
    "contract_id": "sites.release",
    "contract_major_version": 1,
    "generated": "DO NOT EDIT — generated by contractsc from the canonical Rust source. Change the Rust type and run `cargo contracts generate`.",
    "generator": "contractsc",
    "generator_version": "0.1.0",
    "schemars_version": "1.2.2",
    "source_digest": "sha256:5322db1a1b573d4066ee8fefdae62e21200289688d2f91a4e616adc55bed9a42",
    "validation_note": "This schema is a LOWER BOUND on validity. Cross-field invariants and canonical-form rules are enforced by the canonical Rust type; see fixtures/invalid-expectations.toml for which layer rejects what."
  },
  "$defs": {
    "DigestHex": {
      "title": "DigestHex",
      "description": "Lowercase hexadecimal bytes of a content digest.",
      "type": "string",
      "examples": [
        "0000000000000000000000000000000000000000000000000000000000000000"
      ],
      "maxLength": 64,
      "pattern": "^[0-9a-f]{64}$"
    },
    "MediaType": {
      "title": "MediaType",
      "description": "Internet media type of stored bytes, without parameters.",
      "type": "string",
      "examples": [
        "text/html",
        "application/pdf"
      ],
      "maxLength": 255,
      "pattern": "^[a-z0-9][a-z0-9!#$&^_.+-]{0,126}/[a-z0-9][a-z0-9!#$&^_.+-]{0,126}$"
    },
    "NavigationEntry": {
      "description": "One entry of the navigation tree of a [`Release`].",
      "type": "object",
      "properties": {
        "children": {
          "description": "The entries under this one, in the order the site shows them.",
          "type": "array",
          "items": {
            "$ref": "#/$defs/NavigationEntry"
          }
        },
        "slug": {
          "description": "The page that the entry opens, which is a page of the release. Absent for an entry that\nonly groups its children.",
          "anyOf": [
            {
              "$ref": "#/$defs/Slug"
            },
            {
              "type": "null"
            }
          ]
        },
        "title": {
          "description": "The text that the site shows for the entry.",
          "$ref": "#/$defs/PageTitle"
        }
      },
      "additionalProperties": false,
      "required": [
        "children",
        "title"
      ]
    },
    "PageTitle": {
      "title": "PageTitle",
      "description": "The title of a page or of a navigation entry, as the release shows it.\n\n1 to 255 characters with no C0 or DEL control character. The pattern carries the\n255-character bound; the length guard is 1020 UTF-8 bytes, the most 255 characters can\ntake.",
      "type": "string",
      "examples": [
        "Start here",
        "Handbook"
      ],
      "maxLength": 1020,
      "pattern": "^[^\\x00-\\x1f\\x7f]{1,255}$"
    },
    "PublicationId": {
      "title": "PublicationId",
      "description": "The id of one publication of a site: 3 to 40 lower-case ASCII letters, digits and `-`.\n\nThe owner chooses the id and writes it in the manifest and in the path of\n`PUT /v1/sites/{site}/publications/{publication}`.",
      "type": "string",
      "examples": [
        "handbook",
        "garden-notes"
      ],
      "maxLength": 40,
      "pattern": "^[a-z0-9-]{3,40}$"
    },
    "ReleaseAsset": {
      "description": "One asset of a [`Release`].",
      "type": "object",
      "properties": {
        "media_type": {
          "description": "The media type that the delivery route serves the bytes with.",
          "$ref": "#/$defs/MediaType"
        },
        "sha256": {
          "description": "The lowercase hex SHA-256 of the asset bytes; the asset URL is `assets/<sha256>`.",
          "$ref": "#/$defs/DigestHex"
        },
        "size_bytes": {
          "description": "The length of the asset bytes.",
          "type": "integer",
          "format": "uint64",
          "minimum": 0
        }
      },
      "additionalProperties": false,
      "required": [
        "media_type",
        "sha256",
        "size_bytes"
      ]
    },
    "ReleasePage": {
      "description": "One page of a [`Release`].",
      "type": "object",
      "properties": {
        "page_sha256": {
          "description": "The lowercase hex SHA-256 of the `sites/page.v1` bytes that the delivery route serves for\nthis slug.",
          "$ref": "#/$defs/DigestHex"
        },
        "slug": {
          "description": "The slug of the page.",
          "$ref": "#/$defs/Slug"
        },
        "title": {
          "description": "The title of the page.",
          "$ref": "#/$defs/PageTitle"
        }
      },
      "additionalProperties": false,
      "required": [
        "page_sha256",
        "slug",
        "title"
      ]
    },
    "SiteId": {
      "title": "SiteId",
      "description": "The id of one site: 3 to 40 lower-case ASCII letters, digits and `-`.\n\nThe grammar is the `site:<site id>` form of `WriteOrigin` in `ratatoskr-notes-contracts`.\nThe owner chooses the id, and it appears in every route under `/v1/sites/{site}/`.",
      "type": "string",
      "examples": [
        "docs",
        "garden-2026"
      ],
      "maxLength": 40,
      "pattern": "^[a-z0-9-]{3,40}$"
    },
    "Slug": {
      "title": "Slug",
      "description": "The slug of one page: unique in its release, and the last part of\n`/v1/sites/{site}/content/pages/{slug}`.\n\nSegments of lower-case ASCII letters, digits and `-`, separated by `/`, at most 1024\ncharacters. The release builder takes the frontmatter key `slug`, or else the vault path\nwithout `.md`, lower-cased, with each run of other characters than ASCII letters, digits\nand `/` replaced by one `-` (workspace spec `site-publications`).",
      "type": "string",
      "examples": [
        "handbook/start",
        "notes/a-b"
      ],
      "maxLength": 1024,
      "pattern": "^[a-z0-9-]+(?:/[a-z0-9-]+)*$"
    }
  }
}
